Job titel,Job description,Company,Employees,Field,Type of work,Level,Remote
Data Analysis Intern (Remote Internship - Analyst),"POSITION: Data Analyst Intern

LOCATION: Remote

SCHEDULE: Part-time (10-20h/week)

About Brainnest:

The business management and training company headquartered in Bremen, Germany. We are a success-driven firm that provides management advisory and contracting services customized to help companies from different industries with business management problems. Brainnest runs, leads, and manages complex projects and initiatives. We have begun from scratch when a network of professionals, Ph.D. holders, and highly skilled personnel bring to the business table their practical and academic years of experience to form up a concrete blueprint on which the company has been designed. Since 2020, we offer a combination of expertise, proficiency, and commitment, leveraging our deep industry experience and applying analytical rigor to deliver exceptional results for companies. We proudly provide top-class consulting and training services for a wide range of industries around the world. A well-equipped team, advanced tools, and modern methodologies are some of what we correctly utilize to offer our clients what makes them the best in their fields.

Our team is looking for a Data Analysis Intern to join them in the upcoming weeks. This position is great for an aspiring data analysis professional looking to work on business-critical projects and gain relevant work experience.

Your profile:

Strong communication skills with the ability to discuss any issues with a wide variety of individuals and groups
Capability to produce content on time, with attention to detail, and an emphasis on identifying and pitching to a target audience
A well-organized team player with the ability to perform various tasks, act individually, and think creatively
Familiarity with Microsoft applications and Zoom
Willingness to learn and develop data analysis skills
Competitive and proactive attitude
Fluency in English

You will learn how to:

Get started with business analytics, including accessing and integrating the right data and constructing a data map
Prepare data, explore it visually, and describe it using statistical methods
Think and talk like an analyst
How to collaborate with others in different roles to get the data you need
Turn information into a work of art and intrigue your audience
Use a powerful set of business analytics tools to create and share visualizations with others in the organization
Make smarter, data-driven decisions
Interpret the data you see, find the data you need, and clean the data to work effectively with the data
Work with data, including how to import data, work with flat files such as CSV, and create data sets for others
Use predictive tools in business analytics that can help companies make better decisions
Use business analytics tools and techniques to leverage sales data and help organizations get more leads, close more deals, and ultimately increase the number of customers

At Brainnest, we’re committed to equal employment opportunity regardless of race, color, ancestry, religion, sex, national origin, sexual orientation, age, citizenship, marital status, disability, gender, gender identity or expression, or veteran status. We strive to be a more equal opportunity workplace.",Brainnest,51-200,Business Consulting and Services,Full-time,Internship,Remote
"Senior Data Analyst, Operational Excellence","We are looking for a Senior Operational excellence Analyst, to join Bolt Food’s Central Operations team on our journey to discover and drive performance improvements all over our markets throughout Europe and Africa and work both with local and HQ teams to achieve our food & grocery delivery goals.

The Central Operations team consists of individuals from all over the world who are closely working together on building the foundations for us to scale our operation globally across the following functions: Sales Operations, Account Management, Partner Operations, Strategic Partnerships and Courier Operations.

You will be helping us build Bolt Food by supporting one or more of these areas in a very dynamic environment. We expect you to be a genuine and proactive team player as you will need to embrace ambiguity at a global scale and approach business challenges in a data-driven and structured manner. It is key to have great attention to detail and the ability to manage multiple projects and stakeholders at once, with strong prioritization skills.


Your daily adventure will include :

Data Analysis. Deep-dive into the data to find insights that drive the strategy and implementation of new projects across markets.
Data Management. Automate and optimise data collection, transformation, loading, analysis, presentation, visualisation, and monitoring processes (build, maintain and improve data pipelines using a wide range of technologies such as AWS Redshift, Airflow, etc).
Project Management. You will work closely with other global teams in order to resolve the most challenging issues in either our partners, couriers or sales operations.
Automations. You will automate workflows and find ways to use code/algorithms to make the operation of local teams more efficient and data-driven.
Review key operational metrics. Availability rate, rejected orders, cooking time, average ratings, delayed orders - these and other metrics define success of our marketplace business. You will be looking for ways to improve them at a global level.
Reporting & Dashboards. Build and maintain reports and dashboards that support key activities and decision making throughout the central organization.

What we are looking for :

Bachelor’s degree in Mathematics, Economics, Computer Science, Information Management, Statistics or related field.
At least 3 years of experience in an analytical role dealing with large volumes of data. Experience in consulting, data analysis, business intelligence, and/or implementing data-driven solutions is a plus.
Amazing Excel, SQL and Python skills.
Experience with some BI tools and data visualisation like Tableau, Power BI or Looker.
Excellent communication & written skills in English.",Bolt,"1,001-5,001",Computer Software,Full-time,Mid-Senior level,-
"Data Scientist, Tools & Workflows","We are building a top European data science team focused on urban mobility and are looking for exceptional people to join our team. You will enjoy an opportunity to use your creativity in algorithm design and apply cutting-edge technologies to develop models, automate and optimize data-driven decisions and enable the entire organization to tap into the value of ML technologies. We partner with people from strong technology companies and computer science institutes.

You’ll be working in the Tools & Workflows (T&W) team which is responsible for optimizing different workflows inside Bolt. Whether helping our Customer Support team handle incoming user requests more efficiently or enabling our mapping specialists to improve our routes and maps, the T&W team has the right tools for the job. The ML projects inside the T&W team range from customer ticket classification and reply automation to workload forecasting and service level optimisation. The challenges of our team include working with 30+ languages (with many low-resource languages) and optimizing work of multi-queue systems with different priorities.

Your daily adventures will include:
Working with a technical stack consisting of Python, Docker, SageMaker, Airflow, Spark, Presto, Databricks
Solving real world problems using time series forecasting methods, deep learning & transformers, mathematical optimisation, gradient boosted trees, and more
Translating business problems to technical specifications
Handling the entire lifecycle from exploratory queries and notebook prototypes to a working machine learning model or other automation that might be serving thousands of calls per second in production
Leveraging our in-house data and model platform that allow you to launch new projects in a matter of days
Working in product feature teams together with data analysts, product managers and software engineers
Discussing the problems and technical innovations within the broader data science team that provides a pool of peers and mentors
Deploy and validate solutions for millions of users, enabling fast feedback and measurable added value to customers

We are looking for:
Industry experience in data science and machine learning (3+ years recommended)
Awareness of both business and technical aspects of data science
Experience in Python programming, including libraries like pandas/numpy/huggingface/sklearn
Industry experience with natural language processing
Experience writing complex SQL queries
Understanding and practical experience with statistical hypothesis testing
Proactive mindset, willingness to take initiative, and work with little supervision
Enthusiasm to collaborate with different roles in product, analytics and engineering to identify problems, explore trends and untap growth opportunities.
Strong verbal and writter communication skills in English
Track record of deploying models to production and measuring the impact

You will get extra credits for:
Product development experience in a technology company
Experience with transformers in production
Experience with queuing systems
Familiarity with any cloud systems (AWS, Azure, Google app engine)
Ph.D in a quantitative field",Bolt,"1,001-5,001",Computer Software,Full-time,Entry level,-
Lead Analyst - Servicing Platform,"We’re looking for a Lead Analyst to join our growing Servicing Tribe across Tallinn, Estonia, Budapest, Hungary or London, UK. This role is a unique opportunity to move Wise’s mission forward, grow as a product leader and help save millions more people money.

Your mission:

Wise has already pioneered new ways for people to transfer money across borders and currencies. Our customers can also manage their hard-earned money with the world’s first platform to offer true multi-currency banking.

Your mission as a lead is to grow a team of analysts, who would help enable our financial crime prevention teams (Fraud, AML, KYC or Verification) to scale globally and help drop our costs. You’ll also work extensively with our Operations leadership team, to help them as they manage, improve and scale our operations.

Here’s how you’ll be contributing to the Servicing Platform Squad:

Leadership
Support and develop the analyst function within the tribe, lead a team of ~3 analysts
Hiring and on-boarding new analysts to the tribe
Mentoring and providing technical support to analysts
Guide analyst work across the tribe; e.g. help junior analysts structure projects, define data structure cross team projects

Supporting the Squad
Support and develop the reporting layer for the area
You’ll partner with our Operations Leadership team to help them build and improve the quality and efficiency of their processes and their performance metrics
Our analysts are embedded into the product teams of the tribe, to help project and measure the impact of our product changes, both for our customer self-service and internal tooling
Work closely with the Data Science team to improve the quality of our data models
Your team will help us understand our support teams' efficiency, the effectiveness of our tooling and workflows, the accuracy of our forecasting and scheduling. You’ll also help the leads of our support team self-serve with data

Product Improvement
Do cost analysis and reconciliation
You’ll oversee our contact data and share contact attribution along with actionable insights across the product teams, helping them engage with the data correctly and in turn reduce contact rates
You’ll identify opportunities how to use our data and machine learning , in order to automate and optimise our processes and solutions

This role will give you the opportunity to:
Choose your path to impact - we believe people are most empowered when they can act autonomously. So rather than telling you what to do, you’ll work with your team to create a vision of your own. Of course, you can always gather feedback from smart, curious people across Wise but you’ll have the freedom to make your own calls
Grow as a leader - Build your team and inspire them to contribute to our mission
Be part of our mission to make money without borders the new normal

About you:
You have experience working across operational teams. You can lead operational analysis, support them with data, and drive operational change
You have led and scaled a team of analysts
You know your way around the infrastructure of analytics and have worked with cloud warehouses (e.g. Snowflake, BigQuery, or Redshift), have knowledge of BI tools (e.g. Looker, Periscope, or Metabase) and/or visualisation tools (e.g. PowerBI or Tableau)
You're highly proficient with SQL, able to write structured and sustainable code and continue to develop and refine this skillset
You have experience structuring basic research experiments (A/B testing)
You can take complex, fuzzy problems and boil them down into concise and actionable insights

Nice to haves:
Experience working in KYC/Fraud prevention domains is a plus
You're proficient with Python, able to automate complex processes and construct robust data pipelines.

Key benefits:
Flexible working - whether it’s working from home, school plays or life admin we get that flexibility is essential and you’re trusted to do the right thing and be responsible
Stock options in a profitable company
Relocation support
Generous parental leave
Pension scheme
Paid sabbatical
Loads of development opportunities
A fun work environment with social activities and events
The opportunity to work with super smart, curious people

We have a hybrid working model at Wise. Different teams will have different requirements depending on the team needs and your role. Find out more about hybrid working at Wise here.

We’re people without borders — without judgement or prejudice, too. We want to work with the best people, no matter their background. So if you’re passionate about learning new things and keen to join our mission, you’ll fit right in.

Also, qualifications aren’t that important to us. If you’ve got great experience, and you’re great at articulating your thinking, we’d like to hear from you.

And because we believe that diverse teams build better products, we’d especially love to hear from you if you’re from an under-represented demographic.
Note: Due to Christmas and New Years please expect a response to your application w/c 2nd January at the latest

If you want to find out more about what it's like to work at Wise visit Wise.Jobs.

Keep up to date with life at Wise by following us on LinkedIn and Instagram.",Wise,"1,001-5,000",Financial Services,Full-time,Mid-Senior level,-
Biostatistician 2 - Real World Evidence (Home-Office Based),"Biostatistician 2- Real World Evidence

Join us on our exciting journey!

Home-Based/Hybrid: Portugal, Czech Republic, Latvia and Estonia.

IQVIA Real-World Evidence (RWE) teams work with clients to help them collect and use real-world data to generate evidence to meet the needs of regulators, payers, providers, and patients.

Our approach is unique in the industry and is defining the way companies develop and apply real-world evidence for healthcare decision making.

We are collaborative, intellectually curious, entrepreneurial, and constantly looking for opportunities to harness the value of real-world evidence in an evolving industry.

We have one of the largest Biostatistics departments within the industry and due to continued growth, we are seeking new brave minds to join our innovative department.

Job Overview:

As a Biostatistician 2, you will be given access to cutting-edge in-house technology, allowing you to work on global projects across a variety of therapeutic areas and thanks to our development opportunities and mentoring at all levels, you will be able to progress your long-term career in the direction you choose.

You will develop statistical methods sections of protocols and prepare statistical analysis plan. Furthermore write specifications for analysis files, consistency checks, tables, and figures.

Communicate with clients regarding study protocol or statistical analysis issues as they arise.

Interpret analyses and write statistical sections of study reports.

Key Responsibilities:
Act as a statistical lead on studies.
Working closely with the Project Team Lead and supervisor to deliver on time, with high quality and within budget.
Writing and performing quality control (QC) reviews of Statistical Analysis Plan (SAP) and Shells.
Writing and maintaining programming specifications. Programming assigned datasets to industry standards.
Assisting with protocol development, sample size calculation.
Building and maintaining effective customer relationships, driving statistical discussions, providing support and / or guidance for statistical activities.
Managing scope of work and budget, and providing revenue and resource forecasts for single studies
Supporting colleagues and providing motivation as needed.
Requirements:
BSc or MSc degree in Biostatistics or related field, and 4-6 year´s relevant experience within the life-science industry
Familiarity with moderately complex statistical methods
Good working knowledge of SAS or R
Great Communication Skills in English
IQVIA is a leading global provider of advanced analytics, technology solutions and clinical research services to the life sciences industry. We believe in pushing the boundaries of human science and data science to make the biggest impact possible – to help our customers create a healthier world. Learn more at https://jobs.iqvia.com",IQVIA,"10,001+",Hospitals and Health Care,Full-time,-,Hybrid
"Data Scientist, Payment Fraud","We are building a top European data science team focused on urban mobility and are looking for exceptional people to join as one of the senior members of the team. You will enjoy an opportunity to use your creativity in algorithm design and apply cutting-edge technologies to develop models, automate and optimize data-driven decisions and enable the entire organization to tap into the value of ML technologies. We partner with people from strong technology companies and computer science institutes.


What this role is about:

You’ll be working in the Fraud team which is responsible for detecting and preventing payment fraud (stolen credit cards, chargebacks, campaigns fraud). Fraud team is a cross functional team consisting of product managers, fraud data analysts, software engineers and data scientists. Our fraud engine is a high load system which inspects every order across all of our business lines to detect potential fraudulent behaviour and financial loss to the company. See what Elizaveta from our data science team wrote about How to stop fraud with ML — best practices at Bolt.

Your daily adventures will include:

Working with a technical stack consisting of Python, Docker, SageMaker, Airflow, Databricks
Building fraud prediction models using gradient boosted trees and other prediction approaches
Designing and running A/B tests. Interpreting test results and proposing improvements to the Fraud product
Optimising the models across all our markets to minimise losses from fraudulent transitions (false negatives) and prevent unnecessary friction for regular users (false positives)
Handling the entire lifecycle from exploratory queries and notebook prototypes to a working machine learning model or other automation that might be serving thousands of calls per second in production
Leveraging our in-house data and model platform that allow you to launch new projects in a matter of days
Working in product feature teams together with data analysts, product managers and software engineers
Discussing the problems and technical innovations within the broader data science team that provides a pool of peers and mentors
Deploy and validate solutions for millions of users, enabling fast feedback and measurable added value to customers

We are looking for:

Experience in Python programming, including libraries like Pandas/Numpy/sklearn/OR-tools
Experience writing complex SQL queries
Experience in applying machine learning algorithms to real world problems
Basics of software version control, cloud infrastructure, build and deployment pipelines
Understanding and practical experience with statistical hypothesis testing
Proactive mindset, willingness to take initiative and work with little supervision
Enthusiasm to collaborate with different roles in product, analytics and engineering to identify problems, explore trends and untap growth opportunities
Strong verbal and written communication skills in English

You will get extra credits for:

Previous experience in fraud detection in payments
Track record of deploying models to production and measuring the impact
Experience conducting control group tests in production environments
Familiarity with any cloud systems (AWS, Azure, Google app engine)
MSc or PhD in a quantitative field",Bolt,"1,001-5,000",Computer Software,Full-time,Entry level,-
"Lead Business Intelligence Analyst, Growth","As a Lead Business Intelligence Analyst, you will be playing a key part in fuelling our rocket growth. You will be responsible for developing and maintaining our business reporting, enhancing Looker data model and creating awesome visualization to support the Growth Analytics team and Bolt Management with BI needs.

Your daily adventures will include:
Develop business reports and dashboards for Growth Analytics team
Perform data analysis by writing SQL queries to answer ad-hoc business questions and provide insights on customer base, marketplace balance, growth metrics for our team
Suggest new metrics, tools, processes for our reporting to ensure consistency and reliability of data-driven decision-making across the organization
Work with cross-teams to audit the definitions of business metrics and accuracy of data, improve data model and data pipelines
Implement appropriate solutions for improving data availability and load times e.g., caching query data, persisting tables, etc
Support Data Engineers in migration to Data Lake to decrease data latency in reporting

We Are Looking For:
5+ years of experience in Business analytics, marketing, data visualization, data modeling, information systems, computer science, data engineering or closely related fields.
Passion for understanding the business needs and processes, visualization of business insights and automation of BI needs.
Experience with the majority of the following skills and tools: SQL, Looker / PowerBI / Tableau, R, Python, Advanced Excel, Excel Macros, Airflow, Databricks, Data Modeling.
Amazing attention to details and high self-organization + awesome visualization skills.
Ability to communicate effectively with different stakeholders and work collaboratively with team members from different backgrounds.

You will get extra credits for:
Experience in gathering the business needs and developing the C-level reporting.
Experience in designing data models, ETL and data pipelines
Automation of reporting in google-sheets.
1-3 years experience with Looker: LookML models development, looks, and dashboards.",Bolt,"1,001-5,000",Computer Software,Full-time,Mid-Senior level,-
